#MOT	Définition
DECOR DE THEÂTRE	N’est pas de la peinture : il suffit de jeter à vrac sur la toile un seau de couleurs ; puis on l’étend avec un balai ; et l’éloignement avec la lumière font l’illusion. <em>Gustave Flaubert</em>
DECORATION	De la Légion d’honneur. <em>Gustave Flaubert</em>
DECORATION	La blaguer, mais la convoiter. <em>Gustave Flaubert</em>
DECORATION	Quand on l’obtient, toujours dire qu’on ne l’a pas demandée. <em>Gustave Flaubert</em>
DECORUM	« Il en faut ! Il en faut ! » <em>Gustave Flaubert</em>
DECORUM	Donne du prestige. <em>Gustave Flaubert</em>
DECORUM	Frappe l’imagination des masses. <em>Gustave Flaubert</em>
DEFAITE	S’essuie, et elle est tellement complète qu’il n’en reste personne pour en porter la nouvelle. <em>Gustave Flaubert</em>
DEICIDE	S’indigner contre, bien que le crime ne soit pas fréquent. <em>Gustave Flaubert</em>
DEJEUNER DE GARCONS	Exige des huîtres, du vin blanc et des gaudrioles. <em>Gustave Flaubert</em>
DEMÊLOIR	Fait tomber les cheveux. <em>Gustave Flaubert</em>
DEMOSTHENES	Ne prononçait pas de discours sans avoir un galet dans la bouche. <em>Gustave Flaubert</em>
DENT	Sont gâtées par le cidre, le tabac, les dragées, la glace, dormir la bouche ouverte et boire de suite après le potage. <em>Gustave Flaubert</em>
DENT ŒILLÈRE	Dangereux de l’arracher parce qu’elle correspond à l’œil. L’arrachement d’une dent « ne fait pas jouir ». <em>Gustave Flaubert</em>
DEPURATIF	Se prend en cachette. <em>Gustave Flaubert</em>
DEPUTE	L’être, comble de la gloire. <em>Gustave Flaubert</em>
DEPUTE	Ne font rien. <em>Gustave Flaubert</em>
DEPUTE	Tonner contre la Chambre des députés. <em>Gustave Flaubert</em>
DEPUTE	Trop de bavards à la Chambre. <em>Gustave Flaubert</em>
DESCARTES	« Cogito, ergo sum. » <em>Gustave Flaubert</em>
DESERT	Produit des dattes. <em>Gustave Flaubert</em>
DESSERT	Les gens vertueux le méprisent. « Non ! non ! pas de pâtisseries ! Jamais de dessert ! » <em>Gustave Flaubert</em>
DESSERT	Regretter qu’on n’y chante plus. <em>Gustave Flaubert</em>
DESSIN	Se compose de trois choses : la ligne, le grain, et le grainé fin ; de plus, le trait de force. Mais le trait de force, il n’y a que le maître seul qui le donne (Christophe.) <em>Gustave Flaubert</em>
DEVOIRS	Les autres en ont envers nous, mais on n’en a pas envers eux. <em>Gustave Flaubert</em>
DEVOIRS	Les exiger de la part des autres, s’en affranchir. <em>Gustave Flaubert</em>
DEVOUEMENT	« Nous sommes bien inférieurs au chien, sous ce rapport ! » <em>Gustave Flaubert</em>
DEVOUEMENT	Se plaindre de ce que les autres en manquent. <em>Gustave Flaubert</em>
DIAMANT	Et dire que ce n’est que du charbon ! <em>Gustave Flaubert</em>
DIAMANT	On finira par en faire ! <em>Gustave Flaubert</em>
DIAMANT	Si nous en trouvions un dans son état naturel, nous ne le ramasserions pas ! <em>Gustave Flaubert</em>
DICTIONNAIRE	En dire : N’est fait que pour les ignorants. <em>Gustave Flaubert</em>
DICTIONNAIRE DE RIMES	S’en servir ? honteux ! <em>Gustave Flaubert</em>
DIDEROT	Toujours suivi de d’Alembert. <em>Gustave Flaubert</em>
DIEU	Voltaire lui-même l’a dit : « Si Dieu n’existait pas, il faudrait l’inventer. » <em>Gustave Flaubert</em>
DILETTANTE	Homme riche, abonné à l’Opéra. <em>Gustave Flaubert</em>
DILIGENCES	Regretter le temps des diligences. <em>Gustave Flaubert</em>
DÎNER	Autrefois on dînait à midi, maintenant on dîne à des heures impossibles. <em>Gustave Flaubert</em>
DÎNER	Dîner si tard que ça ne s’appelle pas dîner, mais souper. <em>Gustave Flaubert</em>
DÎNER	Le dîner de nos pères était notre déjeuner, et notre déjeuner était leur dîner. <em>Gustave Flaubert</em>
DIOGÈNE	« Je cherche un homme. » <em>Gustave Flaubert</em>
DIOGÈNE	« Retire-toi de mon soleil. » <em>Gustave Flaubert</em>
DIPLOMATIE	Belle carrière (mais hérissée de difficultés, pleine de mystères). <em>Gustave Flaubert</em>
DIPLOMATIE	Métier d’une vague signification, mais au-dessus du commun. <em>Gustave Flaubert</em>
DIPLOMATIE	Ne convient qu’aux gens nobles. <em>Gustave Flaubert</em>
DIPLOMATIE	Un diplomate est toujours fin et pénétrant. <em>Gustave Flaubert</em>
DIPLÔME	Ne prouve rien. <em>Gustave Flaubert</em>
DIPLÔME	Signe de science. <em>Gustave Flaubert</em>
DIRECTOIRE	« Dans ce temps-là, l’honneur s’était réfugié aux armées. » <em>Gustave Flaubert</em>
DIRECTOIRE	Les femmes, à Paris, se promenaient toutes nues. <em>Gustave Flaubert</em>
DIRECTOIRE	Les hontes du. <em>Gustave Flaubert</em>
DISSECTION	Outrage à la majesté de la mort. <em>Gustave Flaubert</em>
DIVORCE	Si Napoléon n’avait pas divorcé, il serait encore sur le trône. <em>Gustave Flaubert</em>
DIX	C’était formidable ! <em>Gustave Flaubert</em>
DIX	Délibérait masqué. <em>Gustave Flaubert</em>
DIX	En trembler encore. <em>Gustave Flaubert</em>
DJIN	Nom d’une danse orientale. <em>Gustave Flaubert</em>
DOCTEUR	Toujours précéder de « bon », et, entre hommes, dans la conversation familière, de « foutre » : Ah ! foutre, docteur ! <em>Gustave Flaubert</em>
DOCTEUR	Tous matérialistes. <em>Gustave Flaubert</em>
DOCTRINAIRES	Les mépriser. Pourquoi ? On n’en sait rien. <em>Gustave Flaubert</em>
DOGE	Épousait la mer. <em>Gustave Flaubert</em>
DOGE	On n’en connaît qu’un : Marino Faliero. <em>Gustave Flaubert</em>
DOLMEN	A rapport aux anciens Français. <em>Gustave Flaubert</em>
DOLMEN	Il n’y en a qu’en Bretagne. <em>Gustave Flaubert</em>
DOLMEN	On n’en sait pas davantage. <em>Gustave Flaubert</em>
DOLMEN	Pierre qui servait au sacrifice des druides. <em>Gustave Flaubert</em>
DÔME	Comment se tient-il ? (S’étonner de ce que cela puisse tenir seul). <em>Gustave Flaubert</em>
DÔME	En citer deux : celui des Invalides et celui de Saint-Pierre de Rome. <em>Gustave Flaubert</em>
DÔME	Tour de forme architecturale. <em>Gustave Flaubert</em>
DOMINOS	On y joue d’autant mieux qu’on est gris. <em>Gustave Flaubert</em>
DOMPTEURS DE BÊTES FEROCES	Emploient des pratiques obscènes. <em>Gustave Flaubert</em>
DONJON	Éveille des idées lugubres. <em>Gustave Flaubert</em>
DORMIR	Épaissit le sang. <em>Gustave Flaubert</em>
DORTOIRS	Préférables aux chambres pour la moralité des élèves. <em>Gustave Flaubert</em>
DORTOIRS	Toujours spacieux et bien aérés. <em>Gustave Flaubert</em>
DOS	Une tape dans le dos peut rendre poitrinaire. <em>Gustave Flaubert</em>
DOUANE	On doit se révolter contre, et la frauder. <em>Gustave Flaubert</em>
DOULEUR	À toujours un résultat favorable. <em>Gustave Flaubert</em>
DOULEUR	La véritable est toujours contenue. <em>Gustave Flaubert</em>
DOUTE	Pire que la négation. <em>Gustave Flaubert</em>
DRAPEAU	Sa vue fait battre le cœur. <em>Gustave Flaubert</em>
DROIT	On ne sait pas ce que c’est. <em>Gustave Flaubert</em>
DUEL	N’est pas une preuve de courage. <em>Gustave Flaubert</em>
DUEL	Prestige de l’homme qui a eu un duel. <em>Gustave Flaubert</em>
DUEL	Tonner contre. <em>Gustave Flaubert</em>
DUPE	Mieux vaut être fripon que dupe. <em>Gustave Flaubert</em>
EAU	L’eau de Cologne sent bon. <em>Gustave Flaubert</em>
EAU	L’eau de mer soutient pour nager. <em>Gustave Flaubert</em>
EAU	L’eau de Paris donne des coliques. <em>Gustave Flaubert</em>
ECHAFAUD	S’arranger quand on y monte pour prononcer quelques mots éloquents avant de mourir. <em>Gustave Flaubert</em>
ECHARPE	Poétique. <em>Gustave Flaubert</em>
ECHECS	Image de la tactique militaire. <em>Gustave Flaubert</em>
ECHECS	Tous les grands capitaines y étaient forts. <em>Gustave Flaubert</em>
ECHECS	Trop sérieux pour un jeu, trop futile pour une science. <em>Gustave Flaubert</em>
ECHO	Citer ceux du Panthéon et du pont de Neuilly. <em>Gustave Flaubert</em>
ECLECTISME	Tonner contre comme étant une philosophie immorale. <em>Gustave Flaubert</em>
ECOLES	À l’École de Médecine : tous exaltés. À l’École de Droit : jeunes gens de bonne famille. <em>Gustave Flaubert</em>
ECOLES	À Saint-Cyr : jeunes gens nobles. <em>Gustave Flaubert</em>
ECOLES	Dire simplement « l’École » fait accroire qu’on y a été. <em>Gustave Flaubert</em>
ECOLES	Polytechnique, rêve de toutes les mères (vieux). <em>Gustave Flaubert</em>
ECOLES	Terreur du bourgeois dans les émeutes quand il apprend que l’École polytechnique sympathise avec les ouvriers (vieux). <em>Gustave Flaubert</em>
ECONOMIE	Citer l’anecdote de Laffitte ramassant une épingle dans la cour du banquier Perregaux. <em>Gustave Flaubert</em>
ECONOMIE	Toujours précédé de « Ordre », mène à la fortune. <em>Gustave Flaubert</em>
ECONOMIE POLITIQUE	Science sans entrailles. <em>Gustave Flaubert</em>
ECRIT, BIEN ECRIT	Mots de portiers, pour désigner les romans-feuilletons qui les amusent. <em>Gustave Flaubert</em>
ECRITURE	Indéchiffrable : signe de science ; exemple : les ordonnances des médecins. <em>Gustave Flaubert</em>
ECRITURE	Une belle écriture mène à tout. <em>Gustave Flaubert</em>
EGOÏSME	Se plaindre de celui des autres et ne pas s’apercevoir du sien. <em>Gustave Flaubert</em>
ELEPHANTS	Se distinguent par leur mémoire, et adorent le soleil. <em>Gustave Flaubert</em>
EMAIL	Le secret en est perdu. <em>Gustave Flaubert</em>
EMBONPOINT	Signe de richesse et de fainéantise. <em>Gustave Flaubert</em>
EMIGRES	Gagnaient leur vie à donner des leçons de guitare et à faire la salade. <em>Gustave Flaubert</em>
EMIR	Ne se dit qu’en parlant d’Abd-el-Kader. <em>Gustave Flaubert</em>
ENCEINTE	Fait bien dans un discours. <em>Gustave Flaubert</em>
ENCEINTE	Le faire entrer dans un discours officiel : Messieurs, dans cette enceinte… <em>Gustave Flaubert</em>
ENCRIER	Se donne en cadeau à un médecin. <em>Gustave Flaubert</em>
ENCYCLOPEDIE	En rire de pitié comme étant un ouvrage rococo et même tonner contre… <em>Gustave Flaubert</em>
ENFANTS	Affecter pour eux une tendresse lyrique quand il y a du monde. <em>Gustave Flaubert</em>
ENGELURE	Signe de santé ; vient de s’être chauffé quand on avait froid. <em>Gustave Flaubert</em>
ENTERREMENT	À propos du défunt : Et dire que je dînais avec lui il y a huit jours ! <em>Gustave Flaubert</em>
ENTHOUSIASME	Ne peut être provoqué que par le retour des cendres de l’Empereur. <em>Gustave Flaubert</em>
ENTR’ACTE	Toujours trop long. <em>Gustave Flaubert</em>
ENVERGURE	Se disputer sur la prononciation du mot. <em>Gustave Flaubert</em>
EPACTE, NOMBRE D’OR, LETTRE DOMINICALE	Sur les calendriers on ne sait pas ce que c’est. <em>Gustave Flaubert</em>
EPARGNE	Occasion de vol pour les domestiques. <em>Gustave Flaubert</em>
EPEE	Regretter le temps où on en portait. <em>Gustave Flaubert</em>
EPERONS	Font bien à une paire de bottes. <em>Gustave Flaubert</em>
EPICURE	Le mépriser. <em>Gustave Flaubert</em>
EPOQUE	L’appeler époque de transition, de décadence. <em>Gustave Flaubert</em>
EPOQUE	Se plaindre de ce qu’elle n’est pas poétique. <em>Gustave Flaubert</em>
EPOQUE	Tonner contre elle. <em>Gustave Flaubert</em>
EPUISEMENT	Toujours prématuré. <em>Gustave Flaubert</em>
EQUITATION	Bon exercice pour faire maigrir. Exemple : tous les soldats de cavalerie sont maigres. <em>Gustave Flaubert</em>
EQUITATION	Pour engraisser. Exemple : tous les officiers de cavalerie ont un gros ventre. <em>Gustave Flaubert</em>
ERECTION	Ne se dit qu’en parlant des monuments. <em>Gustave Flaubert</em>
ERUDITION	La mépriser comme étant la marque d’un esprit étroit. <em>Gustave Flaubert</em>
ESCRIME	Les maîtres d’escrime savent des bottes secrètes. <em>Gustave Flaubert</em>
ESCROC	Est toujours du grand monde. <em>Gustave Flaubert</em>
ESPLANADE	Ne se voit qu’aux Invalides. <em>Gustave Flaubert</em>
ESTOMAC	Toutes les maladies viennent de l’estomac. <em>Gustave Flaubert</em>
ETAGERE	Indispensable chez une jolie femme. <em>Gustave Flaubert</em>
ETALON	Pour les petites filles, cheval plus gros qu’un autre. <em>Gustave Flaubert</em>
ETE	Toujours exceptionnel. <em>Gustave Flaubert</em>
ETERNUEMENT	Après qu’on a dit : Dieu vous bénisse, engager une discussion sur l’origine de cet usage. <em>Gustave Flaubert</em>
ETOILE	Chacun a la sienne. <em>Gustave Flaubert</em>
ETRANGER	Dénigrement de tout ce qui n’est pas français, preuve de patriotisme. <em>Gustave Flaubert</em>
ETRANGER	Engouement pour tout ce qui vient de l’étranger, preuve de l’esprit libéral. <em>Gustave Flaubert</em>
ETRENNES	S’indigner contre. <em>Gustave Flaubert</em>
ETRUSQUE	Tous les vases anciens sont étrusques. <em>Gustave Flaubert</em>
ETYMOLOGIE	Rien de plus facile à trouver avec le latin et un peu de réflexion. <em>Gustave Flaubert</em>
EUNUQUE	Fulminer contre les castrats de la chapelle Sixtine. <em>Gustave Flaubert</em>
EXECUTIONS CAPITALES	Se plaindre des femmes qui vont les voir. <em>Gustave Flaubert</em>
EXERCICE	Préserve de toutes les maladies : toujours conseiller d’en faire. <em>Gustave Flaubert</em>
EXPOSITION	Sujet de délire du XIXe siècle. <em>Gustave Flaubert</em>
EXTIRPER	Ce verbe ne s’emploie que pour les hérésies et les cors aux pieds. <em>Gustave Flaubert</em>
FABRIQUE	Voisinage dangereux. <em>Gustave Flaubert</em>
FACTURE	Toujours trop élevé. <em>Gustave Flaubert</em>
FAISAN	Très chic dans un dîner. <em>Gustave Flaubert</em>
FAISCEAUX	À former, est le comble de la difficulté dans garde nationale. <em>Gustave Flaubert</em>
FARD	Abîme la peau. <em>Gustave Flaubert</em>
FAUTE	« C’est pire qu’un crime, c’est une faute. » (Talleyrand.) « Il ne vous reste plus de faute à commettre » (Thiers.) <em>Gustave Flaubert</em>
FAUTE	Ces deux phrases doivent être articulées avec profondeur. <em>Gustave Flaubert</em>
FAUX MONNAYEURS	Travaillent toujours dans les souterrains. <em>Gustave Flaubert</em>
FAUX RÂTELIERS	Prendre garde de l’avaler en dormant. <em>Gustave Flaubert</em>
FAUX RÂTELIERS	Troisième dentition. <em>Gustave Flaubert</em>
FEMMES DE CHAMBRE	Connaissent tous leurs secrets et les trahissent. <em>Gustave Flaubert</em>
FEMMES DE CHAMBRE	Plus jolies que leurs maîtresses. <em>Gustave Flaubert</em>
FEMMES DE CHAMBRE	Toujours déshonorées par le fils de la maison. <em>Gustave Flaubert</em>
FEODALITE	N’en avoir aucune idée précise, mais tonner contre. <em>Gustave Flaubert</em>
FERMIER	Tous à leur aise. <em>Gustave Flaubert</em>
FEU	Purifie tout. <em>Gustave Flaubert</em>
FEU	Quand on entend crier « au feu ! » on doit commencer par perdre la tête. <em>Gustave Flaubert</em>
FEUILLETONS	Cause de démoralisation. <em>Gustave Flaubert</em>
FEUILLETONS	Écrire à l’auteur pour lui donner (fournir) des idées. <em>Gustave Flaubert</em>
FEUILLETONS	Se disputer sur le dénouement probable. <em>Gustave Flaubert</em>
FIÈVRE	Est causée par les prunes. <em>Gustave Flaubert</em>
FIÈVRE	Preuve de la force du sang. <em>Gustave Flaubert</em>
FIGARO	Encore une des causes de la Révolution ! <em>Gustave Flaubert</em>
FILLES	Articuler ce mot timidement. <em>Gustave Flaubert</em>
FILLES	Les jeunes filles : Éviter pour elles tout espèce de livres. <em>Gustave Flaubert</em>
FLAMANT	Oiseau ainsi nommé parce qu’il vient des Flandres. <em>Gustave Flaubert</em>
FŒTUS	Toute pièce anatomique conservée dans l’esprit-de-vin. <em>Gustave Flaubert</em>
FONCTIONNAIRE	Inspire le respect, quelque (sic) soit la fonction qu’il remplisse. <em>Gustave Flaubert</em>
FONDEMENT	Toutes les nouvelles en manquent. <em>Gustave Flaubert</em>
FONDS SECRETS	S’indigner contre. <em>Gustave Flaubert</em>
FONDS SECRETS	Sommes incalculables avec lesquelles les ministres achètent les consciences. <em>Gustave Flaubert</em>
FORCATS	Au bagne, il y a des hommes de génie. <em>Gustave Flaubert</em>
FORCATS	Ont toujours une figure patibulaire. <em>Gustave Flaubert</em>
FORCATS	Tous très adroits de leurs mains. <em>Gustave Flaubert</em>
FORNARINA	C’était une belle femme ; inutile d’en savoir plus long. <em>Gustave Flaubert</em>
FORTUNE	Quand on vous parle d’une grande fortune, ne pas manquer de dire. « Oui, mais est-elle bien sûre ? » <em>Gustave Flaubert</em>
FOSSILES	Plaisanterie de bon goût, en parlant d’un académicien. <em>Gustave Flaubert</em>
FOSSILES	Preuve du déluge. <em>Gustave Flaubert</em>
FOUDRES DU VATICAN	En rire. <em>Gustave Flaubert</em>
FOULARD	Il est « comme il faut » de se moucher dedans (dans un foulard). <em>Gustave Flaubert</em>
FOULE	À toujours de bons instincts. <em>Gustave Flaubert</em>
FOURMIS	Bel exemple à citer devant un dissipateur. <em>Gustave Flaubert</em>
FOURMIS	Ont donné l’idée des caisses d’épargne. <em>Gustave Flaubert</em>
FOURRURE	Signe de richesse. <em>Gustave Flaubert</em>
FRANC-MACONNERIE	Cause de dispute dans les ménages. <em>Gustave Flaubert</em>
FRANC-MACONNERIE	Encore une des causes de la Révolution ! <em>Gustave Flaubert</em>
FRANC-MACONNERIE	Les épreuves d’initiation sont terribles : quelques-uns en sont morts ! <em>Gustave Flaubert</em>
FRANC-MACONNERIE	Mal vue des ecclésiastiques. <em>Gustave Flaubert</em>
FRANC-MACONNERIE	Quel peut bien être son secret ? <em>Gustave Flaubert</em>
FRANCAIS	Le premier peuple de l’Univers. <em>Gustave Flaubert</em>
FRANCS-TIREURS	Plus terribles que l’ennemi. <em>Gustave Flaubert</em>
FRESQUE	On n’en fait plus. <em>Gustave Flaubert</em>
FRICASSEE	Ne se fait bien qu’à la campagne. <em>Gustave Flaubert</em>
FRISER, FRISURE	Ne convient pas à un homme. <em>Gustave Flaubert</em>
FROID	Plus sain que la chaleur. <em>Gustave Flaubert</em>
FROMAGE	Citer l’aphorisme de Brillat-Savarin : « un dîner sans fromage est une belle à qui il manque un œil. » <em>Gustave Flaubert</em>
FRONT	Large et chauve, signe de génie. <em>Gustave Flaubert</em>
FRONTISPICE	Les grands hommes font bien dessus. <em>Gustave Flaubert</em>
FRUSTE	À bien se rappeler quand on achète des curiosités. <em>Gustave Flaubert</em>
FRUSTE	Tout ce qui antique est fruste, et tout ce qui est fruste est antique. <em>Gustave Flaubert</em>
FUGUE	On ignore en quoi cela consiste, mais il faut affirmer que c’est difficile et très ennuyeux. <em>Gustave Flaubert</em>
FULMINER	Joli verbe. <em>Gustave Flaubert</em>
FUSIL	Toujours en avoir un à la campagne. <em>Gustave Flaubert</em>
FUSILLER	Joie de l’individu à qui on accorde cette faveur. <em>Gustave Flaubert</em>
FUSILLER	Plus noble que guillotiner. <em>Gustave Flaubert</em>
FUSION DES BRANCHES ROYALES	L’espérer toujours ! <em>Gustave Flaubert</em>
GAGNE-PETIT	Belle enseigne pour une boutique, comme inspirant la confiance. <em>Gustave Flaubert</em>
GALBE	Dire devant toute statue qu’on examine : « Ça ne manque pas de galbe. » <em>Gustave Flaubert</em>
GALETS	Il [faut] en rapporter de la mer. <em>Gustave Flaubert</em>
GAMIN	A invariablement beaucoup d’esprit. <em>Gustave Flaubert</em>
GAMIN	Toujours suivi « de Paris ». <em>Gustave Flaubert</em>
GARES DE CHEMIN DE FER	S’extasier devant elles et les donner comme modèles d’architecture. <em>Gustave Flaubert</em>
GARNISON DE JEUNE HOMME	Id est culex pubensis. <em>Gustave Flaubert</em>
GAUCHERS	Plus adroits que ceux qui se servent de la main droite. <em>Gustave Flaubert</em>
GAUCHERS	Terribles à l’escrime. <em>Gustave Flaubert</em>
GENDARMES	Rempart de la société. <em>Gustave Flaubert</em>
GENERATION SPONTANEE	Idée de socialiste. <em>Gustave Flaubert</em>
GENIE	Inutile de l’admirer, c’est une névrose. <em>Gustave Flaubert</em>
GENOVEFAIN	On ne sait pas ce que c’est. <em>Gustave Flaubert</em>
GENRE EPISTOLAIRE	Genre de style exclusivement réservé aux femmes. <em>Gustave Flaubert</em>
GENTILHOMME	Il n’y [en] a plus. <em>Gustave Flaubert</em>
GIAOUR	Expression farouche, d’une signification inconnue, mais on sait que ça a rapport à l’Orient. <em>Gustave Flaubert</em>
GIBELOTTE	Toujours faite avec du chat. <em>Gustave Flaubert</em>
GIBERNE	Étui pour bâton de maréchal de France. <em>Gustave Flaubert</em>
GIBIER	N’est bon que faisandé. <em>Gustave Flaubert</em>
GIRONDINS	Plus à plaindre qu’à blâmer. <em>Gustave Flaubert</em>
GLACES	Il est dangereux d’en prendre. <em>Gustave Flaubert</em>
GLÈBE	S’apitoyer sur la… <em>Gustave Flaubert</em>
GLOIRE	N’est qu’un peu de fumée. <em>Gustave Flaubert</em>
GOBELINS	Est une œuvre inouïe et qui demande cinquante ans à finir. <em>Gustave Flaubert</em>
GOBELINS	L’ouvrier ne sait pas ce qu’il fait. <em>Gustave Flaubert</em>
GOBELINS	S’écrier devant : c’est plus beau que la peinture ! <em>Gustave Flaubert</em>
GOD SAVE THE KING	Chez Béranger se prononce : God savé te King, et rime avec Sauvé (Préservé). <em>Gustave Flaubert</em>
GOMME ELASTIQUE	Est faite avec le scrotum de cheval. <em>Gustave Flaubert</em>
GOTHIQUE	Style d’architecture portant plus à la religion que les autres. <em>Gustave Flaubert</em>
GRAMMAIRE	L’apprendre aux enfants dès le plus bas âge, comme étant une chose claire et facile. <em>Gustave Flaubert</em>
GRAS	Font le désespoir des bourreaux parce qu’elles offrent des difficultés d’exécution. Exemple : la Dubarry. <em>Gustave Flaubert</em>
GRAS	Les personnes grasses n’ont pas besoin d’apprendre à nager. <em>Gustave Flaubert</em>
GRÊLE	Les femmes grêlées sont toutes lascives. <em>Gustave Flaubert</em>
GRENIER	On y est bien à vingt ans. <em>Gustave Flaubert</em>
GRENOUILLE	La femelle du crapaud. <em>Gustave Flaubert</em>
GROG	Pas comme il faut. <em>Gustave Flaubert</em>
GROTTES À STALACTITES	Il y a eu dedans une fête célèbre, bal ou souper, donné par un grand personnage. <em>Gustave Flaubert</em>
GROTTES À STALACTITES	On y a dit la messe pendant la Révolution. <em>Gustave Flaubert</em>
GROTTES À STALACTITES	On y voit « comme des tuyaux d’orgue ». <em>Gustave Flaubert</em>
GROUPE	Convient sur une cheminée et en politique. <em>Gustave Flaubert</em>
GUERILLA	Fait plus de mal à l’ennemi que l’armée régulière. <em>Gustave Flaubert</em>
GULF-STREAM	Ville célèbre de Norvège, nouvellement découverte. <em>Gustave Flaubert</em>
GYMNASE	Succursale de la Comédie-Française. <em>Gustave Flaubert</em>
GYMNASTIQUE	Exténue les enfants. <em>Gustave Flaubert</em>
GYMNASTIQUE	On ne saurait trop en faire. <em>Gustave Flaubert</em>
HABIT NOIR	En province, est le dernier terme de la cérémonie et du dérangement. <em>Gustave Flaubert</em>
HALEINE	L’avoir « forte » donne « l’air distingué ». <em>Gustave Flaubert</em>
HAMAC	Indispensable dans un jardin. <em>Gustave Flaubert</em>
HAMAC	Propre aux créoles. <em>Gustave Flaubert</em>
HAMAC	Se persuader qu’on y est mieux que dans un lit. <em>Gustave Flaubert</em>
HAMEAU	Fait bien en poésie. <em>Gustave Flaubert</em>
HAMEAU	Substantif attendrissant. <em>Gustave Flaubert</em>
HANNETONS	Beau sujet d’opuscule. Leur destruction radicale est le rêve de tout préfet. <em>Gustave Flaubert</em>
HAQUENEE	Animal blanc du Moyen Âge dont la race est disparue. <em>Gustave Flaubert</em>
HARAS	Beau sujet de discussion parlementaire. <em>Gustave Flaubert</em>
HARENGS	Fortune de la Hollande. <em>Gustave Flaubert</em>
HARPE	Fait valoir le bras et la main. <em>Gustave Flaubert</em>
HARPE	Ne se joue, en gravure, que sur des ruines ou au bord d’un torrent. <em>Gustave Flaubert</em>
HARPE	Produit des harmonies célestes. <em>Gustave Flaubert</em>
HEBREU	Est hébreu tout ce qu’on ne comprend pas. <em>Gustave Flaubert</em>
HEIDUQUE	Le confondre avec Eunuque. <em>Gustave Flaubert</em>
HELICE	Avenir de la mécanique. <em>Gustave Flaubert</em>
HEMICYCLE	Ne connaître que celui des Beaux-Arts. <em>Gustave Flaubert</em>
HEMORROÏDES	Vient de s’asseoir sur les poêles et sur les bancs de pierre. <em>Gustave Flaubert</em>
HENRI III ET HENRI IV	À propos de ces rois, ne pas manquer de dire : « Tous les Henri ont été malheureux. » <em>Gustave Flaubert</em>
HERMAPHRODITE	Chercher à en voir. <em>Gustave Flaubert</em>
HERMAPHRODITE	Excite la curiosité malsaine. <em>Gustave Flaubert</em>
HERNIE	Tout le monde en a sans le savoir. <em>Gustave Flaubert</em>
HIATUS	Ne pas le tolérer. <em>Gustave Flaubert</em>
HIEROGLYPHES	Ancienne langue des Égyptiens, inventée par les prêtres pour cacher leurs secrets criminels. <em>Gustave Flaubert</em>
HIEROGLYPHES	Après tout, c’est peut-être une blague ? <em>Gustave Flaubert</em>
HIEROGLYPHES	Et dire qu’il y a des gens qui les comprennent ! <em>Gustave Flaubert</em>
HIPPOCRATE	On doit toujours le citer en latin, parce qu’il écrivait en grec. <em>Gustave Flaubert</em>
HIVER	Est plus sain que les autres saisons. <em>Gustave Flaubert</em>
HIVER	Toujours exceptionnel (voy. Été). <em>Gustave Flaubert</em>
HOBEREAUX DE CAMPAGNE	Avoir pour eux le plus souverain mépris. <em>Gustave Flaubert</em>
HOMÈRE	Célèbre par sa façon de rire : un rire homérique. <em>Gustave Flaubert</em>
HOMÈRE	N’a jamais existé. <em>Gustave Flaubert</em>
HORIZONS	Trouver beaux ceux de la nature, et sombres ceux de la politique. <em>Gustave Flaubert</em>
HOSPODAR	Fait bien dans une phrase, à propos de « la question d’Orient ». <em>Gustave Flaubert</em>
HÔTELS	Ne sont bons qu’en Suisse. <em>Gustave Flaubert</em>
HUGO	A eu bien tort vraiment de s’occuper de politique. <em>Gustave Flaubert</em>
HUILE D’OLIVE	Il faut avoir un ami de Marseille qui vous en fait venir un petit tonneau. <em>Gustave Flaubert</em>
HUILE D’OLIVE	N’est jamais bonne. <em>Gustave Flaubert</em>
HUÎTRES	On n’en mange plus ! elles sont trop chères ! <em>Gustave Flaubert</em>
HUMEUR	Se réjouir quand elle sort, et s’étonner que le corps humain puisse en contenir de si grandes quantités. <em>Gustave Flaubert</em>
HUMIDITE	Cause de toutes les maladies. <em>Gustave Flaubert</em>
HYDRE	Tâcher de la vaincre. <em>Gustave Flaubert</em>
